{
  "chronicle_version": "1.0.0",
  "chronicle_type": "phase",
  "id": "phase-113-denominators-empty",
  "title": "Empty Denominator Chronicle",
  "generated_at": "2026-05-21T10:20:00Z",
  "source": {
    "milestone_id": "v3.1",
    "phase_id": "113",
    "source_file_paths": [
      ".planning/milestones/v3.1/phases/113-chronicle-schema/PLAN.md"
    ]
  },
  "sections": {
    "observations": [
      {
        "id": "obs-1",
        "heading": "Empty permitted",
        "signifier_role": "observations",
        "body": "The root empty reason permits empty denominator arrays."
      }
    ],
    "claims": [
      {
        "id": "claim-1",
        "heading": "Reason supplied",
        "signifier_role": "claims",
        "body": "Empty denominator arrays are valid when denominators_empty_reason is present.",
        "citations": [
          "DLB-11-R2"
        ]
      }
    ],
    "evidence_verdicts": [
      {
        "id": "verdict-1",
        "heading": "Contract satisfied",
        "signifier_role": "evidence_verdicts",
        "body": "All five arrays are present."
      }
    ],
    "decisions": [
      {
        "id": "decision-1",
        "heading": "Retain buckets",
        "signifier_role": "decisions",
        "body": "Empty buckets are not omitted."
      }
    ],
    "denominators": [
      {
        "id": "denom-1",
        "heading": "No entries",
        "signifier_role": "denominators",
        "body": "The section points to the root empty reason."
      }
    ],
    "synthesis": [
      {
        "id": "synth-1",
        "heading": "Empty denominator summary",
        "signifier_role": "synthesis",
        "body": "The fixture demonstrates the documented empty denominator path.",
        "citations": [
          "DLB-11-R2"
        ]
      }
    ],
    "autonomy_disclosure": [
      {
        "id": "auto-1",
        "heading": "Autonomy",
        "signifier_role": "autonomy_disclosure",
        "body": "No autonomous omission is implied."
      }
    ]
  },
  "diagrams": [
    {
      "puml_source": "@startuml\n[Empty arrays] --> [Reason]\n@enduml",
      "rendered_svg": "super-gsd/chronicles/denominators-empty.svg",
      "repo_path_labels": [
        "super-gsd/schemas/chronicle.schema.json"
      ],
      "arrow_intent_labels": [
        "reason permits empty arrays"
      ]
    }
  ],
  "assets": [
    "super-gsd/chronicles/denominators-empty.svg"
  ],
  "denominators": {
    "scope_excluded": [],
    "carve_outs_not_fired": [],
    "alternatives_rejected": [],
    "assumptions_made": [],
    "gates_skipped": []
  },
  "denominators_empty_reason": "This fixture covers the explicit empty denominator path."
}
